Title,Release Year,Locations,Fun Facts,Production Company,Distributor,Director,Writer,Actor 1,Actor 2,Actor 3,
Dawn of the Planet of the Apes,2014,Alioto Park,,"Fox Louisiana Productions, LLC",Twentieth Century Fox,Matt Reeves,Rick Jaffa,Gary Oldman,Keri Russell,Andy Serkis,
Dawn of the Planet of the Apes,2014,California & Powell ,,"Fox Louisiana Productions, LLC",Twentieth Century Fox,Matt Reeves,Rick Jaffa,Gary Oldman,Keri Russell,Andy Serkis,
Dawn of the Planet of the Apes,2014,Columbus & Pacific Ave,,"Fox Louisiana Productions, LLC",Twentieth Century Fox,Matt Reeves,Rick Jaffa,Gary Oldman,Keri Russell,Andy Serkis,
Days of Wine and Roses,1962,,,Warner Bros. Pictures,Warner Bros. Pictures,Blake Edwards,JP Miller,Jack Lemmon,Lee Remick,Charles Bickford,
Desperate Measures,1998,,,Mandalay Entertainment,TriStar Pictures,Barbet Schroeder,David Klass,Michael Keaton,Andy Garcia,Raven-Symone,
Dim Sum: A Little Bit of Heart,1985,San Francisco International Airport,SFO has a museum dedicated to aviation history. ,CIM,Orion Classics,Wayne Wang,Terrel Seltzer,Laureen Chew,Kim Chew,Victor Wong,
Dim Sum: A Little Bit of Heart,1985,"Li Po (916 Grant Avenue at Washington, Chinatown)",,CIM,Orion Classics,Wayne Wang,Terrel Seltzer,Laureen Chew,Kim Chew,Victor Wong,
Dim Sum: A Little Bit of Heart,1985,Chinatown,"First established in the mid-19th Century, SF's Chinatown is the oldest and largest Chinatown in the US.",CIM,Orion Classics,Wayne Wang,Terrel Seltzer,Laureen Chew,Kim Chew,Victor Wong,
Dirty Harry,1971,"Marina Green, Marina District","Before the 1906 earthquake, the land on which Marina Green sits was a tidal marsh, and rubble from the earthquake was dumped on the site. However, the site was filled in to provide land for the 1915 Panama-Pacific Exhibition. ",The Malpaso Company,Warner Brothers,Don Siegel,Harry Julian Fink,Clint Eastwood,Harry Guardino,,
Dirty Harry,1971,"Washington Square, North Beach",,The Malpaso Company,Warner Brothers,Don Siegel,Harry Julian Fink,Clint Eastwood,Harry Guardino,,
Dirty Harry,1971,The Embarcadero,,The Malpaso Company,Warner Brothers,Don Siegel,Harry Julian Fink,Clint Eastwood,Harry Guardino,,
Dirty Harry,1971,"St. Peter & Paul's Church (666 Filbert Street, Washington Square)","Though Marilyn Monroe and Joe DiMaggio were not allowed to be married at the Church (DiMaggio had married his first wife at the Church but was divorced), the couple returned to the steps of the Church for photos, following their City Hall nuptials.",The Malpaso Company,Warner Brothers,Don Siegel,Harry Julian Fink,Clint Eastwood,Harry Guardino,,
Dirty Harry,1971,San Francisco Drydock (20th and Illinois Streets),,The Malpaso Company,Warner Brothers,Don Siegel,Harry Julian Fink,Clint Eastwood,Harry Guardino,,
Dirty Harry,1971,Portsmouth Square (Chinatown),In 1847 the first public school in California was erected on what would become Portsmouth Square.,The Malpaso Company,Warner Brothers,Don Siegel,Harry Julian Fink,Clint Eastwood,Harry Guardino,,
Dirty Harry,1971,"Mt. Davidson Cross, Mt. Davidson","The cross sits at the highest point in San Francisco (938 feet). This version of the cross was erected in 1934.Though in Dirty Harry the cross is lit at night, the City stopped this practice in 1990.",The Malpaso Company,Warner Brothers,Don Siegel,Harry Julian Fink,Clint Eastwood,Harry Guardino,,
Dirty Harry,1971,Mission Dolores Park (Mission District),"The two land plots that comprise the Park were used as a Jewish cemetery until 1894 when San Francisco prohibited all burials within city limits. The graves were moved to Colma, CA.",The Malpaso Company,Warner Brothers,Don Siegel,Harry Julian Fink,Clint Eastwood,Harry Guardino,,
Dirty Harry,1971,"Kezar Stadium, Golden Gate Park",The stadium was demolished and completely rebuilt after sustaining damages in the 1898 Loma Prieta earthquake.,The Malpaso Company,Warner Brothers,Don Siegel,Harry Julian Fink,Clint Eastwood,Harry Guardino,,
Dirty Harry,1971,Holiday Inn Select Downtown Hotel (750 Kearney Street),,The Malpaso Company,Warner Brothers,Don Siegel,Harry Julian Fink,Clint Eastwood,Harry Guardino,,
Dirty Harry,1971,Hall of Justice (850 Bryant Street),,The Malpaso Company,Warner Brothers,Don Siegel,Harry Julian Fink,Clint Eastwood,Harry Guardino,,
Dirty Harry,1971,Forest Hill Station- MUNI,,The Malpaso Company,Warner Brothers,Don Siegel,Harry Julian Fink,Clint Eastwood,Harry Guardino,,
Dirty Harry,1971,Dante Building (1606 Stockton Street at Union),,The Malpaso Company,Warner Brothers,Don Siegel,Harry Julian Fink,Clint Eastwood,Harry Guardino,,
Dirty Harry,1971,"California Hall (625 Polk Street, Van Ness/Civic Center)",,The Malpaso Company,Warner Brothers,Don Siegel,Harry Julian Fink,Clint Eastwood,Harry Guardino,,
Dirty Harry,1971,Bank of America Building (555 California Street),"The Bank of America Building was the tallest building on the West Coast from 1969-1972, when it was surpassed by the TransAmerica Pyramid. Today, the Bank of America building is the 5th tallest building on the West Coast.",The Malpaso Company,Warner Brothers,Don Siegel,Harry Julian Fink,Clint Eastwood,Harry Guardino,,
Doctor Dolittle,1998,Webster Street,,Twentieth Century Fox Film Cooperation,Twentieth Century Fox Film Cooperation,Betty Thomas,Nat Mauldin,Eddie Murphy,Ossie Davis,,
Doctor Dolittle,1998,Telegraph Hill Blvd (Telegraph Hill),,Twentieth Century Fox Film Cooperation,Twentieth Century Fox Film Cooperation,Betty Thomas,Nat Mauldin,Eddie Murphy,Ossie Davis,,
Doctor Dolittle,1998,Larkin & Hyde Streets,,Twentieth Century Fox Film Cooperation,Twentieth Century Fox Film Cooperation,Betty Thomas,Nat Mauldin,Eddie Murphy,Ossie Davis,,
Doctor Dolittle,1998,Gabbiano's Restaurant (Ferry Building),"Every hour and half-hour, the clock bell atop the Ferry Building chimes portions of the Westminster Quarters.",Twentieth Century Fox Film Cooperation,Twentieth Century Fox Film Cooperation,Betty Thomas,Nat Mauldin,Eddie Murphy,Ossie Davis,,
Doctor Dolittle,1998,Coit Tower,"The Tower was funded by a gift bequeathed by Lillie Hitchcock Coit, a socialite who reportedly liked to chase fires. Though the tower resembles a firehose nozzle, it was not designed this way.",Twentieth Century Fox Film Cooperation,Twentieth Century Fox Film Cooperation,Betty Thomas,Nat Mauldin,Eddie Murphy,Ossie Davis,,
Doctor Dolittle,1998,2107 Union Street,,Twentieth Century Fox Film Cooperation,Twentieth Century Fox Film Cooperation,Betty Thomas,Nat Mauldin,Eddie Murphy,Ossie Davis,,
Doctor Dolittle,1998,2100 Green Street,,Twentieth Century Fox Film Cooperation,Twentieth Century Fox Film Cooperation,Betty Thomas,Nat Mauldin,Eddie Murphy,Ossie Davis,,
Dopamine,2003,"South Park (Between 2nd and 3rd Streets, Brannan and Bryant Streets)",,Kontent Films,Sundance Channel Home Entertainment,Mark Decena,Mark Decena & Timothy Breitbach,John Livingston,Sabrina Lloyd,,
Dopamine,2003,"Fort Point (Presidio, Golden Gate National Recreation Area)","Built in 1853, Fort Point is the only West Coast fort built by the Union Army. Though the Confederate army planned to attack San Francisco, the commanding Confederate general learned that the war had ended while end route to SF.",Kontent Films,Sundance Channel Home Entertainment,Mark Decena,Mark Decena & Timothy Breitbach,John Livingston,Sabrina Lloyd,,
Down Periscope,1996,,,Twentieth Century Fox Film Corp.,Twentieth Century Fox Film Corp.,David S. Ward,Hugh Wilson,Kelsey Grammar,Lauren Holly,,
Dr. Dolittle 2,2001,"West Chrissy Field (Presidio, Golden Gate National Recreation Area)",This movie was the first to film in the revamped Chrissy Field Picnic Area.,Twentieth Century Fox Film Corp.,Twentieth Century Fox Film Corp.,Steve Carr,Larry Levin,Eddie Murphy,Kristen Wilson,,
Dr. Dolittle 2,2001,"Sacramento St., Between Pierce & Broderick Streets ",,Twentieth Century Fox Film Corp.,Twentieth Century Fox Film Corp.,Steve Carr,Larry Levin,Eddie Murphy,Kristen Wilson,,
Dr. Dolittle 2,2001,Hyde Street & Lombard Street,,Twentieth Century Fox Film Corp.,Twentieth Century Fox Film Corp.,Steve Carr,Larry Levin,Eddie Murphy,Kristen Wilson,,
Dr. Dolittle 2,2001,"Building 924, Presidio (Golden Gate National Recreation Area)","In 1776, Spain made the Presidio a fortified area. The area was then given to Mexico, but then given to the US in 1848. The 1994 demilitarization of the area in 1994 marked the end of its 219 years of military use. ",Twentieth Century Fox Film Corp.,Twentieth Century Fox Film Corp.,Steve Carr,Larry Levin,Eddie Murphy,Kristen Wilson,,
Dr. Dolittle 2,2001,"Broadway, Between Franklin & Laguna Streets",,Twentieth Century Fox Film Corp.,Twentieth Century Fox Film Corp.,Steve Carr,Larry Levin,Eddie Murphy,Kristen Wilson,,
Dream for an Insomniac,1996,Baker Beach,"From 1986-1990, the north end of Baker Beach was home to the Burning Man festival.",Triton Productions,Columbia TriStar Home Video,Tiffanie DeBartolo,Tiffanie DeBartolo,Ione Skye,Jennifer Aniston,,
Dream for an Insomniac,1996,Elbo Room (647 Valencia Street),"This location is called the ""Caf̩ Blue Eyes"" in the film.",Triton Productions,Columbia TriStar Home Video,Tiffanie DeBartolo,Tiffanie DeBartolo,Ione Skye,Jennifer Aniston,,
Dream with the Fishes,1997,Pier 39,,3 Ring Circus Films,Sony Pictures Classics,Finn Taylor,Finn Taylor & Jeffrey Brown,David Arquette,Brad Hunt,,
Dream with the Fishes,1997,Bay Bridge,"Before opening in 1936, the bridge was blessed by Cardinal Secretary of State Eugenio Pacelli, who later became Pope Pius XII. ",3 Ring Circus Films,Sony Pictures Classics,Finn Taylor,Finn Taylor & Jeffrey Brown,David Arquette,Brad Hunt,,
Dying Young,1991,,,Twentieth Century Fox Corporation,Twentieth Century Fox Corporation,Joel Schumacher,Richard Friedenberg,Julia Roberts,Campbell Scott,,
Edtv,1999,Palace of Fine Arts (3301 Lyon Street),"The original Palace was built for the 1915 Panama-Pacific Exposition, and completely destroyed in 1964. It was rebuilt in 1965.",Imagine Entertainment,MCA / Universal Pictures,Ron Howard,Lowell Ganz,Matthew McConaughey,Jenna Elfman,,
Edtv,1999,Moose's Restaurant (1652 Stockton),,Imagine Entertainment,MCA / Universal Pictures,Ron Howard,Lowell Ganz,Matthew McConaughey,Jenna Elfman,,
Edtv,1999,Mario's Bohemian Cigar Store (Washington Square),,Imagine Entertainment,MCA / Universal Pictures,Ron Howard,Lowell Ganz,Matthew McConaughey,Jenna Elfman,,
Edtv,1999,"Center for the Arts, Yerba Buena Gardens (701 Mission Street)",,Imagine Entertainment,MCA / Universal Pictures,Ron Howard,Lowell Ganz,Matthew McConaughey,Jenna Elfman,,
Edtv,1999,"Castro Theatre (429 Castro Street, The Castro)","The original Castro Theatre was built in 1910, a few doors down from the current theatre. The original theatre was converted into retail space, and the current theatre was built in the 1920s.",Imagine Entertainment,MCA / Universal Pictures,Ron Howard,Lowell Ganz,Matthew McConaughey,Jenna Elfman,,
Edtv,1999,20th & Connecticut Streets (Potrero Hill),,Imagine Entertainment,MCA / Universal Pictures,Ron Howard,Lowell Ganz,Matthew McConaughey,Jenna Elfman,,
Edtv,1999,19 Green Street (North Beach),,Imagine Entertainment,MCA / Universal Pictures,Ron Howard,Lowell Ganz,Matthew McConaughey,Jenna Elfman,,
Edtv,1999,1138 Filbert Street,,Imagine Entertainment,MCA / Universal Pictures,Ron Howard,Lowell Ganz,Matthew McConaughey,Jenna Elfman,,
Edtv,1999,North Beach Video (1398 Grant Avenue at Green),The video store has since moved to an adjacent location. ,Imagine Entertainment,MCA / Universal Pictures,Ron Howard,Lowell Ganz,Matthew McConaughey,Jenna Elfman,,
Escape From Alcatraz,1979,Alcatraz Island,Alcatraz Island was a military fort before it became a prison.,Paramount Pictures,Paramount Pictures,Donald Siegel,Richard Tuggle,Clint Eastwood,Patrick McGoohan,Robert Blossom,
Experiment in Terror,1962,George Washington High School (600 32nd Avenue ),,Columbia Pictures Corporation,Columbia Pictures,Blake Edwards,The Gordons,Glenn Ford,Lee Remick,Stefanie Powers,
Experiment in Terror,1962,"Wells Fargo Bank (1 California Street, Financial District)",,Columbia Pictures Corporation,Columbia Pictures,Blake Edwards,The Gordons,Glenn Ford,Lee Remick,Stefanie Powers,
Experiment in Terror,1962,The Sea Captain's Chest (Fisherman's Wharf),,Columbia Pictures Corporation,Columbia Pictures,Blake Edwards,The Gordons,Glenn Ford,Lee Remick,Stefanie Powers,
Experiment in Terror,1962,"Sheraton Palace Hotel (2 Montgomery Street, Financial District)","The hotel was destroyed in the 1906 earthquake and fire, had to be rebuilt, and was reopened in 1909. ",Columbia Pictures Corporation,Columbia Pictures,Blake Edwards,The Gordons,Glenn Ford,Lee Remick,Stefanie Powers,
Experiment in Terror,1962,Roaring Twenties Nightclub (555 Broadway at Columbus),,Columbia Pictures Corporation,Columbia Pictures,Blake Edwards,The Gordons,Glenn Ford,Lee Remick,Stefanie Powers,
Experiment in Terror,1962,Candlestick Park,"Then Vice President Richard Nixon threw out the first pitch when Candlestick opened in 1960. On August 29, 1966, The Beatles played their last concert for paying fans at Candlestick Park.",Columbia Pictures Corporation,Columbia Pictures,Blake Edwards,The Gordons,Glenn Ford,Lee Remick,Stefanie Powers,
Experiment in Terror,1962,2632 Larkin Street at Lombard,,Columbia Pictures Corporation,Columbia Pictures,Blake Edwards,The Gordons,Glenn Ford,Lee Remick,Stefanie Powers,
Experiment in Terror,1962,100 St. Germain Avenue,,Columbia Pictures Corporation,Columbia Pictures,Blake Edwards,The Gordons,Glenn Ford,Lee Remick,Stefanie Powers,
Experiment in Terror,1962,1 Montgomery Street at Post,,Columbia Pictures Corporation,Columbia Pictures,Blake Edwards,The Gordons,Glenn Ford,Lee Remick,Stefanie Powers,
Faces of Death,1978,,,F.O.D Productions,Aquarius Releasing,Conan Le Cilaire,Alan Black,Michael Carr,,,
Family Plot,1976,Grace Cathedral Episcopal Church (1100 California Street),Grace Cathedral Episcopal Church is the West Coast's largest Episcopalian cathedral.,Universal Pictures,Universal Pictures,Alfred Hitchcock,Ernest Lehman,Karen Black,Bruce Dern,Barbara Harris,
Family Plot,1976,"Fairmont Hotel (950 Mason Street, Nob Hill)","In 1945 the Fairmont hosted the United Nations Conference on International Organization as delegates arrived to draft a charter for the organization. The U.S. Secretary of State, Edward Stettinius drafted the charter in the hotel's Garden Room.",Universal Pictures,Universal Pictures,Alfred Hitchcock,Ernest Lehman,Karen Black,Bruce Dern,Barbara Harris,
Family Plot,1976,2230 Sacramento Street,"Called ""1001 Franklin"" in the film.",Universal Pictures,Universal Pictures,Alfred Hitchcock,Ernest Lehman,Karen Black,Bruce Dern,Barbara Harris,
Family Plot,1976,Nob Hill,"Railroad tycoons like Leland Stanford (founder of Stanford University) lived in Nob Hill at the turn of the 20th Century. The 1906 earthquake completely destroyed Nob Hill, with the exception of the wall that surrounded the mansions of Stanford and his neighbor Mark Hopkins. ",Universal Pictures,Universal Pictures,Alfred Hitchcock,Ernest Lehman,Karen Black,Bruce Dern,Barbara Harris,
Fandom,2004,,,The Digital Golem,Cinequest Distribution,Nicholas Tucker,Nicholas Tucker & Mark Hefti,Mark Hefti,Peter Quintana,,
Fat Man and Little Boy,1989,"Postcard Row (Alamo Square, Hayes Valley)",The 6 Victorian homes across from Alamo Square Park are among the few Victorians to survive the Great Fire.,Paramount Pictures,Paramount Pictures,Roland Joffe,Roland Joffe,Paul Newman,John Cusack,,
Fathers' Day,1997,,,Northern Lights Entertainment,Columbia Broadcasting System,Ivan Reitman,Lowell Ganz,Robin Williams,Billy Crystal,,
Fearless,1993,400 Montgomery Street,,Spring Creek Productions,Warner Bros. Pictures,Peter Weir,Rafael Yglesias,Jeff Bridges,Isabella Rosellini,Rosie Perez,
Fearless,1993,Folsom Street & Embarcadero,,Spring Creek Productions,Warner Bros. Pictures,Peter Weir,Rafael Yglesias,Jeff Bridges,Isabella Rosellini,Rosie Perez,
Fearless,1993,Varennes Alley between Filbert and Union,,Spring Creek Productions,Warner Bros. Pictures,Peter Weir,Rafael Yglesias,Jeff Bridges,Isabella Rosellini,Rosie Perez,
Fearless,1993,"St. Peter & Paul's Church (666 Filbert Street, Washington Square)","Though Marilyn Monroe and Joe DiMaggio were not allowed to be married at the Church (DiMaggio had married his first wife at the Church but was divorced), the couple returned to the steps of the Church for photos, following their City Hall nuptials.",Spring Creek Productions,Warner Bros. Pictures,Peter Weir,Rafael Yglesias,Jeff Bridges,Isabella Rosellini,Rosie Perez,
Fearless,1993,"San Francisco General Hospital Medical Center (1001 Potrero Avenue, Potrero Hill)",SF General Hospital is the only Level I Trauma Center serving San Francisco and northern San Mateo County. ,Spring Creek Productions,Warner Bros. Pictures,Peter Weir,Rafael Yglesias,Jeff Bridges,Isabella Rosellini,Rosie Perez,
Fearless,1993,Kohl Building (400 Montgomery Street),,Spring Creek Productions,Warner Bros. Pictures,Peter Weir,Rafael Yglesias,Jeff Bridges,Isabella Rosellini,Rosie Perez,
Fearless,1993,Bank of America Building (555 California Street),"The Bank of America Building was the tallest building on the West Coast from 1969-1972, when it was surpassed by the TransAmerica Pyramid. Today, the Bank of America building is the 5th tallest building on the West Coast.",Spring Creek Productions,Warner Bros. Pictures,Peter Weir,Rafael Yglesias,Jeff Bridges,Isabella Rosellini,Rosie Perez,
Fearless,1993,90 Gold Street,,Spring Creek Productions,Warner Bros. Pictures,Peter Weir,Rafael Yglesias,Jeff Bridges,Isabella Rosellini,Rosie Perez,
Fearless,1993,5th and Beale Streets,,Spring Creek Productions,Warner Bros. Pictures,Peter Weir,Rafael Yglesias,Jeff Bridges,Isabella Rosellini,Rosie Perez,
Final Analysis,1992,"Westin St. Francis Hotel (335 Powell Street, Union Square)","The hotel was originally supposed to be named the Crocker Hotel, after Charles Founder the railroad magnate who founded it. However, the hotel took the name the St. Francis after one of the earliest Gold Rush hotels. ",Warner Bros. Pictures,Warner Bros. Pictures,Phil Joanou,Robert Berger,Richard Gere,Kim Basinger,,
Final Analysis,1992,"Public Health Service Hospital (Presidio, Golden Gate National Recreation Area)","In 1776, Spain made the Presidio a fortified area. The area was then given to Mexico, but then given to the US in 1848. The 1994 demilitarization of the area in 1994 marked the end of its 219 years of military use. ",Warner Bros. Pictures,Warner Bros. Pictures,Phil Joanou,Robert Berger,Richard Gere,Kim Basinger,,
Final Analysis,1992,"Presidio, Golden Gate National Recreation Area","In 1776, Spain made the Presidio a fortified area. The area was then given to Mexico, but then given to the US in 1848. The 1994 demilitarization of the area in 1994 marked the end of its 219 years of military use. ",Warner Bros. Pictures,Warner Bros. Pictures,Phil Joanou,Robert Berger,Richard Gere,Kim Basinger,,
Final Analysis,1992,City Hall,"The dome of SF's City Hall is almost a foot taller than that of the US Capitol Building. In 1954, Joe DiMaggio and Marilyn Monroe married at the Beaux Arts-style building.",Warner Bros. Pictures,Warner Bros. Pictures,Phil Joanou,Robert Berger,Richard Gere,Kim Basinger,,
Final Analysis,1992,Bix Restaurant (56 Gold Street),,Warner Bros. Pictures,Warner Bros. Pictures,Phil Joanou,Robert Berger,Richard Gere,Kim Basinger,,
Flower Drum Song,1961,Golden Gate Bridge,"With 23 miles of ladders and 300,000 rivets in each tower, the Golden Gate Bridge was the world's longest span when it opened in 1937.",Fields Productions,Universal Pictures,Henry Koster,Joseph Fields,Nancy Kwan,James Shigeta,Benson Fong,
Flower Drum Song,1961,Chinatown,"First established in the mid-19th Century, SF's Chinatown is the oldest and largest Chinatown in the US.",Fields Productions,Universal Pictures,Henry Koster,Joseph Fields,Nancy Kwan,James Shigeta,Benson Fong,
Flubber,1997,Treasure Island,"An artificial island, Treasure Island was created for the 1939 Golden Gate International Exposition, and is named after the novel by Robert Louis Stevenson, a one-time San Francisco resident.",Walt Disney Pictures,Buena Vista Pictures,Les Mayfield,Samuel W. Taylor,Robin Williams,Marcia Gay Harden,,
Forrest Gump,1994,Palace of Fine Arts (3301 Lyon Street),"The original Palace was built for the 1915 Panama-Pacific Exposition, and completely destroyed in 1964. It was rebuilt in 1965.",Paramount Pictures,Paramount Pictures,Robert Zemeckis,Eric Roth,Tom Hanks,Robin Wright,,
Foul Play,1978,War Memorial Opera House (401 Van Ness Avenue),In 1945 the United Nations had its first conference at The War Memorial Opera House.,Paramount Pictures,Paramount Pictures,Colin Higgins,Colin Higgins,Goldie Hawn,Chevy Chase,Burgess Meredith,
Foul Play,1978,Sutter & Buchannan Streets,,Paramount Pictures,Paramount Pictures,Colin Higgins,Colin Higgins,Goldie Hawn,Chevy Chase,Burgess Meredith,
Foul Play,1978,Sutter & Baker Streets,,Paramount Pictures,Paramount Pictures,Colin Higgins,Colin Higgins,Goldie Hawn,Chevy Chase,Burgess Meredith,
Foul Play,1978,Sokoji-Soto Zen Buddhist Temple (1691 Laguna Street),,Paramount Pictures,Paramount Pictures,Colin Higgins,Colin Higgins,Goldie Hawn,Chevy Chase,Burgess Meredith,
Foul Play,1978,Sacramento & Hyde Streets (Nob Hill),,Paramount Pictures,Paramount Pictures,Colin Higgins,Colin Higgins,Goldie Hawn,Chevy Chase,Burgess Meredith,
Foul Play,1978,"Postcard Row (Alamo Square, Hayes Valley)",The 6 Victorian homes across from Alamo Square Park are among the few Victorians to survive the Great Fire.,Paramount Pictures,Paramount Pictures,Colin Higgins,Colin Higgins,Goldie Hawn,Chevy Chase,Burgess Meredith,
Foul Play,1978,Potrero Hill Bathhouse & Feed Co. (199 Mississippi Street),,Paramount Pictures,Paramount Pictures,Colin Higgins,Colin Higgins,Goldie Hawn,Chevy Chase,Burgess Meredith,
Foul Play,1978,Octavia & Hayes Streets (Hayes Valley),,Paramount Pictures,Paramount Pictures,Colin Higgins,Colin Higgins,Goldie Hawn,Chevy Chase,Burgess Meredith,
Foul Play,1978,Montgomery & Pine Streets (Financial District),,Paramount Pictures,Paramount Pictures,Colin Higgins,Colin Higgins,Goldie Hawn,Chevy Chase,Burgess Meredith,
Foul Play,1978,Laguna & Sacramento Streets (Pacific Heights),,Paramount Pictures,Paramount Pictures,Colin Higgins,Colin Higgins,Goldie Hawn,Chevy Chase,Burgess Meredith,
Foul Play,1978,"Hayes Valley Care (601 Laguna Street, Hayes Valley)",,Paramount Pictures,Paramount Pictures,Colin Higgins,Colin Higgins,Goldie Hawn,Chevy Chase,Burgess Meredith,
Foul Play,1978,Golden Gate & Steiner Streets (Hayes Valley),,Paramount Pictures,Paramount Pictures,Colin Higgins,Colin Higgins,Goldie Hawn,Chevy Chase,Burgess Meredith,
Foul Play,1978,"Fort Point, Presidio","Built in 1853, Fort Point is the only West Coast fort built by the Union Army. Though the Confederate army planned to attack San Francisco, the commanding Confederate general learned that the war had ended while end route to SF.",Paramount Pictures,Paramount Pictures,Colin Higgins,Colin Higgins,Goldie Hawn,Chevy Chase,Burgess Meredith,
Foul Play,1978,Fort Mason (Golden Gate National Recreation Area),"Constructed in 1864 as a coastal defense site, Fort Mason went on to serve as an army post for more than 100 years.",Paramount Pictures,Paramount Pictures,Colin Higgins,Colin Higgins,Goldie Hawn,Chevy Chase,Burgess Meredith,
Foul Play,1978,Flood Building (870 Market Street),,Paramount Pictures,Paramount Pictures,Colin Higgins,Colin Higgins,Goldie Hawn,Chevy Chase,Burgess Meredith,
Foul Play,1978,"Fiesta Laundromat (898 S. Van Ness Ave., Mission)",,Paramount Pictures,Paramount Pictures,Colin Higgins,Colin Higgins,Goldie Hawn,Chevy Chase,Burgess Meredith,
Foul Play,1978,City Hall,"The dome of SF's City Hall is almost a foot taller than that of the US Capitol Building. In 1954, Joe DiMaggio and Marilyn Monroe married at the Beaux Arts-style building.",Paramount Pictures,Paramount Pictures,Colin Higgins,Colin Higgins,Goldie Hawn,Chevy Chase,Burgess Meredith,
Foul Play,1978,California & Larkin Streets (Nob Hill),,Paramount Pictures,Paramount Pictures,Colin Higgins,Colin Higgins,Goldie Hawn,Chevy Chase,Burgess Meredith,
Foul Play,1978,"Asian Art Museum (200 Larkin Street, Civic Center)",The Dalai Lama opened an exhibition on Wisdom and Compassion at the museum in 1991.,Paramount Pictures,Paramount Pictures,Colin Higgins,Colin Higgins,Goldie Hawn,Chevy Chase,Burgess Meredith,
Foul Play,1978,Andrew S. Hallidie Plaza (Market & Powell Streets),,Paramount Pictures,Paramount Pictures,Colin Higgins,Colin Higgins,Goldie Hawn,Chevy Chase,Burgess Meredith,
Foul Play,1978,430 Vallejo Street (Telegraph Hill),,Paramount Pictures,Paramount Pictures,Colin Higgins,Colin Higgins,Goldie Hawn,Chevy Chase,Burgess Meredith,
Foul Play,1978,24th and Castro Streets (Noe Valley),,Paramount Pictures,Paramount Pictures,Colin Higgins,Colin Higgins,Goldie Hawn,Chevy Chase,Burgess Meredith,
Freebie and the Bean,1974,Alco Plaza,,Warner Bros. Pictures,American Broadcasting Company (ABC),Richard Rush,Robert Kaufman,Alan Arkin,James Caan,Loretta Swit,
Freebie and the Bean,1974,Twin Peaks,"The 2nd highest point in SF after Mt. Davidson, Twin Peaks sit at the geographic center of SF. The native Ohlone people called the area ""called the area ���Los Pechos de la Chola�۝ or ""Breasts of the Indian Maiden,"" but in the 19th Century when America took over the area, it was renamed ""Twin Peaks"".",Warner Bros. Pictures,American Broadcasting Company (ABC),Richard Rush,Robert Kaufman,Alan Arkin,James Caan,Loretta Swit,
